{
  "v": "0",
  "frame_type": "Discovery",
  "frame_kind": "Cairn.Context",
  "id": "HQE21EQ651JH0F0NJ04P19KYF9",
  "ts": "2026-01-11T23:55:00-05:00",
  "actor": {
    "kind": "human",
    "id": "human:alice",
    "kid": "kid:alice"
  },
  "context": {
    "neighborhood": "nh:alpha",
    "project": "proj:demo",
    "branch": "main",
    "topic": "topic://nh:alpha/cairn"
  },
  "policy": {
    "policy_id": "pol:cairn-default",
    "policy_hash": "0000000000000000000000000000000000000000000000000000000000000000",
    "purpose": "investigation"
  },
  "payload_schema": "cairn/context.v0.jsonschema.json",
  "payload": {
    "context_id": "cx:demo-1",
    "engine": "neo4j",
    "dataset_ref": "snapshot://kb/demo@sha256:abcd",
    "seed_entities": [
      "node:root-1",
      "node:root-2"
    ],
    "frontier": {
      "ordered": [
        "node:root-1",
        "node:root-2"
      ],
      "dedup_set_hash": "aaaaaaaaaaaaaaaaaaaaaaaaaaaaaaaaaaaaaaaaaaaaaaaaaaaaaaaaaaaaaaaa",
      "cap_k": 50,
      "dedup_strategy": "identity",
      "stable_order": "rank_then_lex"
    },
    "constraints": {
      "allowed_relations": [
        ":REFERENCES",
        ":SUPPORTS"
      ],
      "max_hops": 6,
      "privacy_mode": "neighborhood",
      "cost_budget": {
        "max_ms": 2000,
        "max_rows": 50000,
        "max_db_hits": 500000,
        "max_exec_jobs": 5
      }
    },
    "created_at": "2026-01-11T23:55:00-05:00"
  },
  "links": [],
  "signatures": [
    {
      "alg": "ed25519",
      "kid": "kid:alice",
      "sig": "ZGVtb19zaWduYXR1cmU=",
      "created_at": "2026-01-11T23:55:00-05:00"
    }
  ]
}
