{
  "v": "0",
  "frame_type": "Prove",
  "frame_kind": "Cairn.StepTrace",
  "id": "01JZZZZZZZZZZZZZZZZZZZZZZZ",
  "ts": "2026-05-07T15:10:00Z",
  "actor": {
    "kind": "agent",
    "id": "cairnpath-validator",
    "kid": "kid-demo-validator"
  },
  "context": {
    "project": "cairnpath-mesh",
    "trace_id": "trace.demo.step.expand.001"
  },
  "policy": {
    "policy_id": "policy.demo.cairn-limits.v0",
    "policy_hash": "0000000000000000000000000000000000000000000000000000000000000000",
    "purpose": "schema-validation-demo",
    "decision_id": "decision.demo.allow.001"
  },
  "payload_schema": "cairn/step_trace.v0.jsonschema.json",
  "payload": {
    "trace_id": "trace.demo.step.expand.001",
    "line_id": "line.demo.001",
    "step_id": "step.demo.expand.001",
    "opcode": "expand",
    "frontier_count_in": 1,
    "expanded_count_raw": 4,
    "dedup_count": 3,
    "frontier_count_out": 3,
    "cap_hit": false,
    "frontier_digest": {
      "algorithm": "sha256",
      "ordered": true,
      "count": 3,
      "digest": "1111111111111111111111111111111111111111111111111111111111111111",
      "canonicalization": "entity-ref-canonical-lines",
      "includes_scores": false,
      "includes_snapshot_ref": false
    },
    "rank_policy_id": "rank.lexicographic-entity-ref",
    "rank_policy_version": "0",
    "dedup_strategy": "identity",
    "backend": "atomspace",
    "backend_adapter_version": "0",
    "backend_query_fingerprint": "meetlink.demo.R.out.v0",
    "policy_id": "policy.demo.cairn-limits.v0",
    "decision_id": "decision.demo.allow.001",
    "replay_mode": "deterministic",
    "elapsed_ms": 0,
    "db_hits": 0,
    "cache_hits": 0,
    "materialized_bytes": 0,
    "warnings": [],
    "created_at": "2026-05-07T15:10:00Z"
  },
  "links": [],
  "idempotency_key": "idem.demo.steptrace.001",
  "replay_nonce": "replay.demo.steptrace.001",
  "signatures": [
    {
      "alg": "ed25519",
      "kid": "kid-demo-validator",
      "sig": "demo-signature-placeholder",
      "created_at": "2026-05-07T15:10:00Z"
    }
  ]
}
