{
  "v": "0",
  "frame_type": "Discovery",
  "frame_kind": "Cairn.Line",
  "id": "CEAP1Z13VJ8DGGBFCNHPJHR295",
  "ts": "2026-01-11T23:55:00-05:00",
  "actor": {
    "kind": "human",
    "id": "human:alice",
    "kid": "kid:alice"
  },
  "context": {
    "neighborhood": "nh:alpha",
    "project": "proj:demo",
    "branch": "main",
    "topic": "topic://nh:alpha/cairn"
  },
  "policy": {
    "policy_id": "pol:cairn-default",
    "policy_hash": "0000000000000000000000000000000000000000000000000000000000000000",
    "purpose": "investigation"
  },
  "payload_schema": "cairn/line.v0.jsonschema.json",
  "payload": {
    "line_id": "cl:demo-1",
    "root_context_id": "cx:demo-1",
    "steps": [
      "cs:demo-0"
    ],
    "status": "draft",
    "created_at": "2026-01-11T23:55:00-05:00",
    "updated_at": "2026-01-11T23:55:00-05:00",
    "description": "demo cairnline"
  },
  "links": [],
  "signatures": [
    {
      "alg": "ed25519",
      "kid": "kid:alice",
      "sig": "ZGVtb19zaWduYXR1cmU=",
      "created_at": "2026-01-11T23:55:00-05:00"
    }
  ]
}
